"Name","Address","CLF","CMHG","CSBG","ITU","MC","MD","MI","OSF","PI","SCJJ","SEF","SF","SI","SMHA","SWFS","VAF","ID","Total","TotalFunded"
"Worcester County Health Department Snow Hill","6040 Public Landing Road Snow Hill, Maryland 21863",1,1,1,0,1,1,1,1,1,1,1,1,1,1,1,0,1,14,12
"Worcester County Health Department Pocomoke Health Center","400 Walnut Street Suite A Pocomoke City, Maryland 21851",1,1,1,0,1,1,1,1,1,1,1,1,1,1,1,0,2,14,12
"Worcester County Behavioral Health Berlin Health Center","9730 Healthway Drive Berlin, Maryland 21811",1,1,1,0,1,1,1,1,1,1,1,1,1,1,1,0,3,14,12
"Woodbourne Center Inc","1301 Woodbourne Avenue Baltimore, Maryland 21239",1,1,1,0,0,1,1,1,1,1,1,1,0,1,0,0,4,11,9
"Wicomico County Health Department Behavioral Health Program","108 East Main Street Salisbury, Maryland 21801",1,0,0,0,0,1,0,1,1,0,0,1,0,1,0,0,5,6,4
"Way Station Inc","9030 Route 108 Suite A Columbia, Maryland 21045",0,0,0,0,1,1,0,0,0,0,0,1,0,0,0,0,6,3,2
"WACS Center","11827 Ocean Gateway Ocean City, Maryland 21842",1,1,1,0,1,1,1,1,1,1,1,1,1,1,1,0,7,14,12
"Volunteers of America/Chesapeake MH and Rehabilitation Servs Division","4611 Assembly Drive Suite D Lanham, Maryland 20706",1,0,0,0,1,1,0,0,0,0,0,0,0,0,0,0,8,3,3
"VOAC Prince Georges Mental Health","8603 Elm Avenue Bowie, Maryland 20715",0,0,0,0,1,1,0,0,0,0,0,0,0,0,0,0,9,2,2
"VOAC Prince Georges Mental Health","2205 Prince of Wales Court Bowie, Maryland 20716",0,0,0,0,1,1,0,0,0,0,0,0,0,0,0,0,10,2,2
"VOAC Prince Georges Mental Health","2706 Baldwin Lane Bowie, Maryland 20715",0,0,0,0,1,1,0,0,0,0,0,0,0,0,0,0,11,2,2
"VOAC Prince Georges Behavioral Health","5807 Cleveland Avenue Riverdale, Maryland 20737",0,0,0,0,1,1,0,0,0,0,0,0,0,0,0,0,12,2,2
"VOAC Montgomery Cnty PRP Office","199 East Montgomery Avenue Suite 212 Rockville, Maryland 20852",0,1,0,0,1,0,0,1,0,0,0,0,1,0,0,0,13,4,4
"Villa Maria OMHC Hagerstown","324 East Antietam Street Suite 307-A Hagerstown, Maryland 21740",1,0,0,0,1,1,0,0,0,1,0,1,0,0,1,0,14,6,5
"Villa Maria of Mountain Maryland Catholic Charities Family Services","308 Virginia Avenue Cumberland, Maryland 21502",1,1,1,0,1,1,0,1,0,1,1,1,0,1,1,0,15,11,10
"Villa Maria of Frederick County Catholic Charities Family Services","300 West 9th Street Frederick, Maryland 21701",0,0,0,0,1,1,0,0,0,0,0,0,0,0,0,0,16,2,2
"Villa Maria of Carroll County BHS","1129 Business Parkway South Suite A Westminster, Maryland 21157",0,0,0,0,1,1,0,0,0,0,0,1,1,1,1,0,17,6,5
"Villa Maria Lansdowne","2700 Washington Avenue Halethorpe, Maryland 21227",1,1,1,0,1,1,0,1,0,1,1,0,0,1,1,0,18,10,10
"Villa Maria Harford County","1301 Continental Drive Suite 101 Abingdon, Maryland 21009",0,0,0,0,1,1,0,0,0,0,0,0,0,0,0,0,19,2,2
"Villa Maria at Fallstaff","6999 Reisterstown Road Baltimore, Maryland 21215",1,1,1,0,1,1,0,1,0,1,1,0,0,1,1,0,20,10,10
"Vesta Inc Lanham Region","9301 Annapolis Road Suite 100 Lanham, Maryland 20706",0,0,0,0,1,1,0,0,0,0,0,1,0,0,0,0,21,3,2
"VA Maryland Healthcare System Perry Point VAMC/MH Clinical Center VAMHCS Perry Point Division ATTN Mental Health Building","80 Perry Point, Maryland 21902",0,0,0,0,0,0,1,0,1,0,0,1,0,0,0,1,22,4,2
"VA Maryland Healthcare System Loch Raven VA Outpatient Clinic","3901 The Alameda Baltimore, Maryland 21218",0,0,0,0,1,1,0,0,1,0,0,0,1,0,0,1,23,5,4
"VA Maryland Healthcare System Glen Burnie VA Outpatient Clinc","808 Landmark Drive Suite 128 Glen Burnie, Maryland 21061",0,0,0,0,0,0,1,0,1,0,0,0,0,0,0,1,24,3,2
"VA Maryland Healthcare System Fort Meade VA Outpatient Clinic","2479 5th Street Fort George G Meade, Maryland 20755",0,0,0,0,0,0,0,0,0,0,0,0,0,0,0,1,25,1,1
"VA Maryland Healthcare System Baltimore VAMC/MH Clinic Center","10 North Greene Street Suite BT-116-MH Baltimore, Maryland 21201",0,0,0,0,1,1,1,0,1,0,0,1,1,0,0,1,26,7,5
"Urban Behavioral Associates PA","5001 Silver Hill Road Suite 101 Suitland, Maryland 20746",0,0,0,0,1,1,0,0,1,0,0,1,0,0,0,0,27,4,2
"Upper Bay Counseling and Support Servs Outpatient Services","#N/A",1,0,0,0,1,1,1,0,1,0,0,1,1,1,1,1,28,10,8
"Upper Bay Counseling and Support Servs Community Services","200 Both Street Elkton, Maryland 21921",1,0,0,0,1,1,1,0,1,0,0,1,0,1,1,0,29,8,6
"Upper Bay Counseling and Support Servs Child Services","200 Booth Street Elkton, Maryland 21921",1,0,0,0,1,1,1,0,1,1,0,1,0,1,1,0,30,9,7
"Upper Bay Counseling and Support Servs Adult Services","200 Booth Street Elkton, Maryland 21921",1,0,0,0,1,1,1,1,1,1,0,1,0,1,0,0,31,9,7
"Upper Bay Counseling and Support Servs","626 Revolution Street Havre de Grace, Maryland 21078",1,0,0,0,1,1,1,0,1,1,0,1,1,1,1,0,32,10,8
"University of Maryland Saint Josephs Medical Center/Dept of Psych","1 West 7601 Osler Drive Towson, Maryland 21204",0,0,0,0,1,1,1,0,1,0,0,1,1,0,0,0,33,6,4
"University of Maryland Medical Center Walter P Carter Carruthers Clinic","827 Linden Avenue 2nd Floor Baltimore, Maryland 21201",0,0,0,0,1,1,0,0,0,0,0,0,0,0,0,0,34,2,2
"University of Maryland Medical Center Fayette Clinic","701 West Pratt Street 3rd Floor Baltimore, Maryland 21201",0,0,0,0,1,1,0,0,0,0,0,0,0,0,0,0,35,2,2
"University of Maryland Medical Center Department of Psychiatry","22 South Greene Street Baltimore, Maryland 21201",0,0,1,0,1,1,1,1,1,0,0,1,1,1,1,0,36,10,8
"University of Maryland Center for Infant Study","701 West Pratt Street 4th Floor Baltimore, Maryland 21201",0,0,0,0,0,1,0,0,1,0,0,0,0,0,0,0,37,2,1
"Universal Therapeutic Center Inc","5602 Baltimore National Pike Suite 700 Catonsville, Maryland 21228",0,0,0,0,0,1,0,0,0,0,0,0,0,0,0,0,38,1,1
"UMMS/PACT","701 West Pratt Street 5th Floor Baltimore, Maryland 21201",0,0,0,0,1,1,0,0,0,0,0,0,0,0,0,0,39,2,2
"UM Harford Memorial Hospital Behavioral Health IP/OP","501 South Union Avenue Havre de Grace, Maryland 21078",0,0,0,0,1,1,1,0,1,0,0,1,1,0,0,1,40,7,5
"TRICO Clinical Services Ltd","46940 South Shangri La Drive Lexington Park, Maryland 20653",1,1,1,1,1,1,1,1,1,1,1,1,1,1,1,1,41,16,14
"Total Health Care Inc","1501 Division Street Baltimore, Maryland 21217",0,0,0,0,1,1,0,0,1,0,0,1,1,1,0,0,42,6,4
"Thomas B Finan Center","10102 Country Club Road Southeast Cumberland, Maryland 21502",0,0,0,0,1,1,0,1,0,0,0,1,1,1,0,0,43,6,5
"Therapeutic Living for Families","3425 Sinclair Lane Baltimore, Maryland 21213",0,0,0,0,1,1,0,0,1,1,0,1,1,1,1,0,44,8,6
"TATEIOMS LLC","14435 Cherry Lane Court Suite 300 Laurel, Maryland 20707",1,0,0,0,1,1,1,0,1,0,0,1,0,0,0,0,45,6,4
"Steven A Cohen Military Family Clinic at Easterseals","1420 Spring Street Suite 300 Silver Spring, Maryland 20910",0,0,0,0,0,0,1,0,0,0,0,1,0,0,0,0,46,2,1
"SMR Counseling Services LLC","3909 National Drive Suite 100 Burtonsville, Maryland 20866",1,1,1,1,0,0,1,1,1,1,1,1,1,1,1,1,47,14,12
"SMR Counseling Services LLC","7915 Malcolm Road Suite 100 Clinton, Maryland 20735",1,1,1,1,0,0,1,1,1,1,1,1,1,1,1,1,48,14,12
"Sheppard Pratt Health Systems The Jefferson School","2940 Point of Rocks Road Jefferson, Maryland 21755",0,0,0,0,0,1,0,0,1,1,1,1,0,0,0,0,49,5,3
"Sheppard Pratt Health System The Mann Residential Treatment Center","6501 North Charles Street Towson, Maryland 21285",1,0,0,0,0,1,0,0,1,1,1,1,1,1,1,0,50,9,7
"Sheppard Pratt at Ellicott City","4100 College Avenue Ellicott City, Maryland 21043",0,0,0,0,1,1,1,1,1,0,0,1,1,0,0,0,51,7,5
"Sheppard Community Services PRP","20 Winters Lane Catonsville, Maryland 21228",1,1,1,0,1,1,0,1,0,0,0,1,0,0,0,0,52,7,6
"Sandstone Care","11820 Parklawn Drive Suite 403 Rockville, Maryland 20852",0,0,0,0,0,0,0,0,1,0,0,1,0,0,0,0,53,2,0
"Safe Journey House","6910 Annapolis Road Hyattsville, Maryland 20784",0,0,0,0,1,1,0,0,0,0,0,0,0,0,0,0,54,2,2
"Rock Creek Foundation","12120 Plum Orchard Drive Suite B Silver Spring, Maryland 20904",1,0,0,0,1,1,0,1,1,0,1,1,1,1,0,0,55,9,7
"Robert A Pascal Youth and Family Servs Youth and Family Services Inc","1215 Annapolis Road Suite 204 Odenton, Maryland 21113",0,1,0,0,0,1,0,1,1,0,0,1,0,0,0,1,56,6,4
"RIMS Ctr for Enrichment/Development","1895 Brightseat Road Hyattsville, Maryland 20785",0,0,0,0,0,1,0,0,0,0,0,1,1,1,0,0,57,4,3
"Retreat at Sheppard Pratt","6501 North Charles Street Towson, Maryland 21204",0,0,0,0,0,0,0,0,0,0,0,1,0,0,0,0,58,1,0
"Regional Institute for Children and Adolescents/Baltimore","605 South Chapel Gate Lane Baltimore, Maryland 21229",1,0,0,0,0,1,1,0,1,1,1,0,0,0,1,0,59,7,6
"Reginald S Lourie Center for Infants and Young Children","12301 Academy Way Rockville, Maryland 20852",1,1,1,0,0,1,0,1,0,0,1,1,0,1,1,0,60,9,8
"Regenerations Counseling Services Inc","1421 South Caton Avenue Suite 201 Halethorpe, Maryland 21227",0,0,0,0,0,1,0,0,0,0,0,0,0,0,0,0,61,1,1
"Regenerations Counseling Services Inc","4600 Forbes Boulevard Suite 202 Lanham, Maryland 20706",0,0,0,0,0,1,0,0,0,0,0,0,0,0,0,0,62,1,1
"Regenerations Counseling Services Inc","3261 Old Washington Road Suite 1040 Waldorf, Maryland 20602",0,0,0,0,0,1,0,0,0,0,0,0,0,0,0,0,63,1,1
"Redeem Healthcare Medical Systems","3240 Belair Road Baltimore, Maryland 21213",0,0,0,0,1,1,0,0,1,0,0,1,0,1,1,0,64,6,4
"Recovery Health Services LLC","3800 Frederick Avenue Baltimore, Maryland 21229",0,0,0,0,0,1,0,0,1,0,0,1,1,1,0,0,65,5,3
"Recovery Health Services LLC","402 Hungerford Drive Rockville, Maryland 20850",0,0,0,0,0,1,0,0,1,0,0,1,1,1,0,0,66,5,3
"QCI of Southern Maryland QCI Behavioral Health","5010 Regency Place Suite 203 White Plains, Maryland 20695",0,0,0,0,1,1,0,0,1,0,0,1,0,0,0,0,67,4,2
"QCI Behavioral Health","9475 Lottsford Road Suite 250 Upper Marlboro, Maryland 20774",1,1,0,0,1,1,1,1,1,0,0,1,1,1,0,0,68,10,8
"Psychotherapeutic Treatment Servs Inc","839 Bestgate Road Annapolis, Maryland 21401",0,0,0,0,1,1,0,0,0,0,0,1,0,0,0,0,69,3,2
"Project Chesapeake","69 Sherry Lane Prince Frederick, Maryland 20678",0,0,0,0,1,1,1,1,1,0,0,1,1,1,1,0,70,9,7
"Pressley Ridge Outpatient Mental Health Clinic","8501 La Salle Road Suite 200 Towson, Maryland 21286",0,0,0,0,1,1,0,0,0,0,0,0,0,0,0,0,71,2,2
"People Encouraging People Primrose","4201 Primrose Avenue Baltimore, Maryland 21215",0,1,0,0,1,1,0,0,0,0,0,0,0,0,0,0,72,3,3
"People Encouraging People","3619 Falls Road Unit 6-B Baltimore, Maryland 21211",0,0,0,0,1,1,0,0,1,0,0,1,0,0,0,0,73,4,2
"People Encouraging People","2301 Dorsey Road Suite 200 Glen Burnie, Maryland 21061",0,0,0,0,1,1,0,0,1,0,0,1,0,0,0,0,74,4,2
"People Encouraging People","337 Brightseat Road Suite 210 Hyattsville, Maryland 20785",0,0,0,0,1,1,0,0,1,0,0,1,0,0,0,0,75,4,2
"People Encouraging People","255 North Stonestreet Avenue Rockville, Maryland 20850",0,0,0,0,1,1,0,0,1,0,0,1,0,0,0,0,76,4,2
"Peninsula Regional Medical Center Behavioral Health","100 East Carroll Street Salisbury, Maryland 21801",0,0,0,0,1,1,1,0,1,0,0,1,1,1,0,1,77,8,6
"Pathways Inc","44101 Airport View Drive Hollywood, Maryland 20636",1,0,0,0,1,1,1,1,1,1,1,1,0,1,1,1,78,12,10
"Omni House Inc Omni Mental Health Clinic","1419 Madison Park Drive Glen Burnie, Maryland 21061",1,0,0,0,1,1,1,0,1,0,0,1,0,1,0,0,79,7,5
"Omni House Inc Day Program","7440 Baltimore Annapolis Boulevard Glen Burnie, Maryland 21061",0,0,0,0,0,1,0,0,0,0,0,1,0,1,0,0,80,3,2
"Omni House Inc Administration/Omnis Residential Prog","1421 Madison Park Drive Glen Burnie, Maryland 21061",0,0,0,0,0,1,0,0,0,0,0,1,0,1,0,0,81,3,2
"New Vision Behavioral Health Servs Inc","5718 Harford Road Suite 103 Baltimore, Maryland 21214",0,0,0,0,0,1,0,0,0,0,0,1,0,0,0,0,82,2,1
"New Vision Behavioral Health Servs Inc","4710 Pennington Avenue 2nd Floor, Suite 3 Curtis Bay, Maryland 21226",0,0,0,0,0,1,0,0,0,0,0,1,0,0,0,0,83,2,1
"Neuropsychiatry Program at The MedStar Good Samaritan Hospital","5601 Loch Raven Boulevard Suite 406, Morgan Building Baltimore, Maryland 21239",0,0,0,0,1,1,0,0,1,0,0,1,0,0,0,0,84,4,2
"National Pike Health Center Inc","1201 West Pratt Street Suite D Baltimore, Maryland 21223",0,0,0,0,0,1,0,0,0,0,0,0,0,0,0,0,85,1,1
"National Pike Health Center Inc","5411 Old Frederick Road Suites 13 and 14 Baltimore, Maryland 21229",0,0,0,0,0,1,0,0,0,0,0,0,0,0,0,0,86,1,1
"National Pike Health Center Inc","23 Shipping Place Dundalk, Maryland 21222",0,0,0,0,0,1,0,0,0,0,0,0,0,0,0,0,87,1,1
"MPB Group Inc Outpatient Mental Health Clinic","6440 Dobbin Road Suite D Columbia, Maryland 21045",1,0,1,0,0,1,0,0,1,1,1,1,1,1,0,0,88,9,7
"Mosaic Community Services Supportive Employment Program","2225 North Charles Street Baltimore, Maryland 21218",0,0,0,0,1,1,1,0,1,0,0,1,0,0,1,0,89,6,4
"Mosaic Community Services Supported Employment Program","288 East Greene Street Westminster, Maryland 21157",1,1,1,0,1,1,0,0,0,0,0,1,0,1,0,0,90,7,6
"Mosaic Community Services Mental Health Clinic","2225 North Charles Street Baltimore, Maryland 21218",0,0,0,0,1,1,0,0,1,0,0,1,0,0,0,0,91,4,2
"Montgomery County MHC/Wheaton Adult Behavioral Health Program","11002 Veirs Mill Road Suite 705 Silver Spring, Maryland 20902",1,0,0,0,1,1,0,0,0,0,0,1,0,0,0,0,92,4,3
"Montgomery County Child/Adol MH Servs","8818 Georgia Avenue Suite 500 Silver Spring, Maryland 20910",1,0,0,0,0,1,0,1,0,0,0,1,0,0,0,0,93,4,3
"Montgomery County Child and Adol/Behav Health Services","7300 Calhoun Place Suite 600 Derwood, Maryland 20855",1,0,0,0,0,1,0,1,0,0,0,1,0,0,0,0,94,4,3
"Metro Family Adult/Childrens Therapeutic Services","723 East Patapsco Avenue Brooklyn, Maryland 21225",0,0,0,0,0,1,0,0,0,0,0,1,1,0,0,0,95,3,2
"Meritus Behavioral Health Services for Meritus Medical Center","11116 Medical Campus Road Hagerstown, Maryland 21742",0,0,0,0,1,1,1,0,1,0,0,1,1,0,0,0,96,6,4
"Mentor Maryland Institute for Family Centered Services","7501 Forbes Boulevard Suite 102 Lanham, Maryland 20706",0,0,0,0,0,1,0,0,0,1,0,0,0,0,0,0,97,2,2
"Mentor Maryland Institute for Family Centered Services","200 Kent Avenue Suite 101 La Plata, Maryland 20646",0,0,0,0,0,1,0,0,0,1,0,0,0,0,0,0,98,2,2
"Medstar Union Memorial Hospital Counseling Center","3300 North Calvert Street Baltimore, Maryland 21218",0,0,0,0,1,1,0,0,1,0,0,0,0,0,0,0,99,3,2
"Medstar Southern Maryland Hospital Ctr Behavioral Health Services Unit","7503 Surratts Road Clinton, Maryland 20735",1,1,1,1,1,1,1,1,1,0,1,1,1,1,1,1,100,15,13
"MedStar Saint Marys Hospital Psych Unit","25500 Point Lookout Road Leonardtown, Maryland 20650",0,0,0,0,1,1,1,0,1,0,0,1,1,0,0,0,101,6,4
"MedStar Montgomery Medical Center Addiction and Mental Health Center","18101 Prince Philip Drive Olney, Maryland 20832",0,0,0,0,1,1,1,0,1,0,0,1,1,0,0,0,102,6,4
"MedPsych Health Services LLC","7101 Guilford Drive Suite 100 Frederick, Maryland 21704",1,0,0,0,0,1,0,1,1,1,1,1,1,1,1,0,103,10,8
"MedPsych Health Services LLC","6237 Executive Boulevard Rockville, Maryland 20852",1,0,0,0,0,1,0,1,1,1,1,1,1,1,1,0,104,10,8
"Marys Center","8908 Riggs Road Hyattsville, Maryland 20783",0,1,1,0,1,1,1,0,1,0,1,1,1,1,0,0,105,10,8
"Marys Center","344 University Boulevard Silver Spring, Maryland 20901",0,1,1,0,1,1,1,0,1,0,1,1,1,1,0,0,106,10,8
"Maryland Treatment/Health Quest","3800 Frederick Avenue Baltimore, Maryland 21229",0,0,0,0,0,1,0,0,1,0,0,1,0,0,0,0,107,3,1
"Maryland Family Resource Inc","903 Brightseat Road Hyattsville, Maryland 20785",1,1,1,0,0,1,0,1,1,1,1,1,0,1,1,0,108,11,9
"Marshy Hope Family Services LLC","1 Chesapeake Drive Cambridge, Maryland 21613",1,0,0,0,1,1,1,1,1,1,0,1,1,1,1,0,109,11,9
"Mar Lyn Housing Centers for Behavioral Health LLC","526 College Parkway Rockville, Maryland 20850",1,0,0,0,0,0,0,0,0,0,0,1,0,0,0,0,110,2,1
"Maple Shade Youth and Family Servs","382 West Main Street Crisfield, Maryland 21817",0,0,0,0,1,1,0,0,0,0,0,1,0,0,0,0,111,3,2
"Maple Shade Mental Health Clinic","23704 Ocean Gateway Mardela Springs, Maryland 21837",0,0,0,0,1,1,0,0,0,0,0,1,0,0,0,0,112,3,2
"Maple Shade","11760 Somerset Avenue Princess Anne, Maryland 21853",0,0,0,0,0,1,0,0,0,0,0,0,0,0,0,0,113,1,1
"M Slutsky and Associates Inc DBA MSA/The Child and Adolescent Ctr","10005 Old Columbia Road Suite L-260 Columbia, Maryland 21046",0,0,0,0,0,1,0,0,1,0,0,1,0,0,0,0,114,3,1
"Lower Shore Clinic Inc","505 East Main Street Salisbury, Maryland 21804",0,0,0,0,1,1,0,0,1,0,0,1,1,1,0,0,115,6,4
"Life Renewal Services Inc","6940 Tudsbury Road Windsor Mill, Maryland 21244",0,0,0,0,0,1,0,0,0,0,0,1,0,0,0,0,116,2,1
"Levindale Hebrew Geriatric Ctr/Hosp","2434 West Belvedere Avenue Baltimore, Maryland 21215",0,0,0,0,1,0,0,0,1,0,0,0,0,0,0,0,117,2,1
"Leading by Example LLC","5026 Campbell Boulevard Suite H Nottingham, Maryland 21236",0,0,0,0,0,1,0,1,1,0,0,0,1,1,0,0,118,5,4
"Lantern Therapeutic Services Inc Waldorf Office","11680 Doolittle Drive Suite 111 Waldorf, Maryland 20602",0,0,0,0,1,1,0,0,0,0,0,1,0,0,0,0,119,3,2
"Lantern Therapeutic Services","8200 Professional Place Suite 104 Hyattsville, Maryland 20785",0,0,0,0,1,1,0,0,0,0,0,1,0,0,0,0,120,3,2
"King Health Systems Inc","3502 West Rogers Avenue Suite 1 Baltimore, Maryland 21215",0,0,0,0,0,1,0,0,0,0,0,1,0,0,0,0,121,2,1
"Key Point Residential Baltimore","1300 Dundalk Avenue Dundalk, Maryland 21222",0,0,0,0,0,1,0,0,0,0,0,1,0,0,0,0,122,2,1
"Key Point Health Services Inc Outpatient Clinic","500 North Rolling Road Catonsville, Maryland 21228",0,0,0,0,1,1,1,0,1,0,0,1,0,0,0,0,123,5,3
"Key Point Health Services Inc Administration and Outpatient Clinic","135 North Parke Street Aberdeen, Maryland 21001",1,1,1,0,1,1,1,1,1,1,1,1,1,1,1,1,124,15,13
"Key Point Health Services Inc","1012 North Point Road Baltimore, Maryland 21224",0,0,0,0,1,1,1,0,1,0,0,1,0,0,0,0,125,5,3
"Kent County Behavioral Health","300 Scheeler Road Chestertown, Maryland 21620",0,0,0,0,1,1,0,0,0,0,0,1,0,0,0,0,126,3,2
"Kennedy Krieger Institute","707 North Broadway Baltimore, Maryland 21205",0,0,0,0,1,1,1,0,1,0,1,1,1,1,0,0,127,8,6
"JR Healthcare DBA Behavioral Health Clinic","2310 North Charles Street Baltimore, Maryland 21218",0,0,0,0,1,1,0,0,1,0,0,1,0,0,0,0,128,4,2
"Johns Hopkins Childrens Mental Health Center","401 North Caroline Street Baltimore, Maryland 21231",0,0,0,0,0,1,1,0,1,0,0,1,1,0,0,0,129,5,3
"Johns Hopkins Bayview Medical Center Co-occurring Disorders in Youth Clinic","5500 East Lombard Street Community Psychiatry Program Baltimore, Maryland 21224",0,0,0,0,1,1,0,0,1,0,0,1,1,0,0,0,130,5,3
"Johns Hopkins Bayview CMHC","4940 Eastern Avenue Baltimore, Maryland 21224",1,0,0,0,1,1,1,1,1,0,1,1,1,0,0,0,131,9,7
"John L Gildner Regional Institute for Children and Adolescents","15000 Broschart Road Rockville, Maryland 20850",1,0,0,0,0,1,0,1,1,1,1,1,1,1,1,0,132,10,8
"JHBMC/Creative Alternatives","1821 A Portal Street Baltimore, Maryland 21224",0,0,0,0,1,1,0,0,0,0,0,0,0,1,0,0,133,3,3
"Institute for Life Enrichment (ILE)","6201 Greenbelt Road Suite M-7 College Park, Maryland 20740",1,0,0,0,1,1,1,1,1,1,0,1,0,1,1,0,134,10,8
"Institute for Life Enrichment","5601 Loch Raven Boulevard Suite 105 Baltimore, Maryland 21239",0,0,0,0,1,1,0,0,1,0,0,0,0,0,0,0,135,3,2
"Institute for Family Centered Services","5970 Frederick Crossing Lane Suite 201 Frederick, Maryland 21704",0,0,0,0,0,1,0,0,0,1,0,0,0,0,0,0,136,2,2
"Institute for Family Centered Services","18227 Flower Hill Way Gaithersburg, Maryland 20879",0,0,0,0,0,1,0,0,0,1,0,0,0,0,0,0,137,2,2
"Innovative Psychiatry LLC","9256 Bendix Road Suite 200-B Columbia, Maryland 21045",0,0,0,0,0,0,0,0,1,0,0,1,0,0,0,0,138,2,0
"Innovative Clinical Associates","8701 Georgia Avenue Suite 500 Silver Spring, Maryland 20910",0,0,0,0,0,1,0,0,1,0,0,1,1,1,0,0,139,5,3
"InnerSourced Solutions LLC","3261 Old Washington Road Suite 2020 Waldorf, Maryland 20602",0,0,0,0,1,1,0,0,1,0,0,1,0,0,0,0,140,4,2
"Holy Cross Germantown Hospital","19801 Observation Drive Germantown, Maryland 20876",0,0,0,0,1,1,1,0,1,0,0,1,1,1,1,0,141,8,6
"Hebron House Inc","2300 Garrison Boulevard Suite 101 Baltimore, Maryland 21216",1,0,1,0,0,1,0,1,0,1,1,1,0,0,1,0,142,8,7
"Healthcare Living for Families","3100 Lord Baltimore Drive Suite 208 Windsor Mill, Maryland 21244",0,0,0,0,0,1,0,0,0,0,0,1,0,0,0,0,143,2,1
"Healthcare for the Homeless Baltimore County","9150 Franklin Square Drive Suite 301 Rosedale, Maryland 21237",0,0,0,0,1,1,0,0,0,0,0,1,0,1,0,0,144,4,3
"Health Care for Homeless","421 Fallsway Baltimore, Maryland 21202",1,1,1,0,1,1,0,1,0,0,0,0,0,0,0,0,145,6,6
"Health Alliance Associates Inc","1017 East Baltimore Street Baltimore, Maryland 21202",0,0,0,0,1,1,0,0,1,0,0,1,0,0,0,0,146,4,2
"Harford County Health Department Division of Behavioral Health","120 South Hays Street Bel Air, Maryland 21014",0,0,0,0,1,1,1,0,1,0,0,1,0,0,0,0,147,5,3
"Harford County Health Department","253 Paradise Road Aberdeen, Maryland 21001",1,1,1,0,0,1,0,1,1,1,1,1,0,1,1,1,148,12,10
"Harford Belair Community Mental Health","4308 Harford Road Baltimore, Maryland 21214",0,0,0,0,1,1,0,0,1,0,0,1,1,0,0,0,149,5,3
"Go Getters Inc Beacon Place","801 Johnson Street Salisbury, Maryland 21801",0,0,0,0,1,1,0,0,0,0,0,0,0,0,0,0,150,2,2
"Glory Health Center Inc","4705 Harford Road Suite B Baltimore, Maryland 21214",0,0,0,0,0,1,0,0,0,0,0,0,0,0,0,0,151,1,1
"Freedom Center","202 Perry Parkway Suite 5 Gaithersburg, Maryland 20877",0,0,0,0,0,0,1,0,1,0,0,1,0,0,0,0,152,3,1
"Frederick Memorial Hospital Behavioral Health Services","400 West 7th Street Second Floor Frederick, Maryland 21701",1,0,0,0,1,1,1,1,1,1,1,1,1,1,1,1,153,13,11
"Frederick County Health Department Outpatient Mental Health Clinic","350 Montevue Lane Frederick, Maryland 21702",1,0,0,0,1,1,0,0,0,0,0,0,0,1,0,0,154,4,4
"Foundations Psychiatric Rehabilitation Program","1025 West Nursery Road Suite 118 Linthicum Heights, Maryland 21090",1,1,0,0,0,1,0,0,1,0,0,1,0,1,0,1,155,7,5
"First Choice Counseling Center","600 Reisterstown Road Suite 402 Pikesville, Maryland 21208",0,0,0,0,0,1,0,0,1,0,0,1,0,0,0,0,156,3,1
"Family Vision","600 Reisterstown Road Suite 204 Pikesville, Maryland 21208",0,0,0,0,0,1,0,0,0,0,0,0,0,0,0,0,157,1,1
"Family Services Inc Montgomery Station/OP MH Clinic","610 East Diamond Street Suite 100 Gaithersburg, Maryland 20877",1,1,1,0,0,1,0,1,0,1,1,1,0,0,1,1,158,10,9
"Family Service Foundation Inc","5301 76th Avenue Hyattsville, Maryland 20784",1,0,0,0,1,1,0,1,0,0,0,1,0,0,1,0,159,6,5
"Family Behavioral Services LLC","1835 University Boulevard East Suite 316 Hyattsville, Maryland 20783",0,0,0,0,1,1,0,0,0,0,0,1,0,1,1,0,160,5,4
"Essential Therapeutic Perspectives Inc","8100 Professional Place Suite 200 Hyattsville, Maryland 20785",1,0,0,0,0,1,0,0,1,1,0,1,1,1,1,0,161,8,6
"Empowering Minds Resource Center","7954 Baltimore Annapolis Boulevard Suite 2E-F Glen Burnie, Maryland 21061",0,0,0,0,0,1,0,0,0,0,0,0,0,0,0,0,162,1,1
"Eastern Shore Psychological Services","11120 Somerset Avenue Princess Anne, Maryland 21853",0,0,0,0,1,1,1,1,1,1,1,1,1,0,1,0,163,10,8
"Eastern Shore Psychological Services","1113 Healthway Drive Salisbury, Maryland 21804",0,0,0,0,1,1,1,1,1,1,1,1,1,0,1,0,164,10,8
"Dynamic Healthcare","516 South Conkling Street Suite A Baltimore, Maryland 21224",0,0,0,0,0,1,0,0,0,0,0,0,0,0,0,0,165,1,1
"Corsica River Mental Health Services Dorchester Office","502 Poplar Street Cambridge, Maryland 21613",1,1,1,0,1,1,0,1,1,0,0,1,1,1,0,0,166,10,8
"Corsica River Mental Health Services","120 Banjo Lane Centreville, Maryland 21617",1,1,1,0,1,1,0,1,1,0,0,1,1,1,0,0,167,10,8
"Cornerstone Montgomery Outpatient Clinic","6040 Southport Drive Bethesda, Maryland 20814",0,0,0,0,1,0,0,0,1,0,0,1,0,0,0,0,168,3,1
"Cornerstone Montgomery Fenton/McAuliffe House","2204 McAuliffe Drive Rockville, Maryland 20851",0,0,0,0,1,0,0,0,0,0,0,0,0,0,0,0,169,1,1
"Cornerstone Montgomery","14221 Chadwick Lane Rockville, Maryland 20853",0,0,0,0,1,0,0,0,0,0,0,0,0,0,0,0,170,1,1
"Cornerstone Montgomery","2 Taft Court Suite 200 Rockville, Maryland 20850",0,0,0,0,1,0,0,0,0,0,0,0,0,0,0,0,171,1,1
"Cornerstone Montgomery","1398 Lamberton Drive Silver Spring, Maryland 20902",0,0,0,0,1,0,0,0,0,0,0,0,0,0,0,0,172,1,1
"Community Csl Mentoring and Services","1300 Mercantile Lane Suite 208 Upper Marlboro, Maryland 20774",1,0,0,0,0,1,0,1,1,1,1,1,1,0,0,0,173,8,6
"Community Behavioral Health","426 Dorchester Avenue Cambridge, Maryland 21613",0,0,0,0,1,1,1,0,1,0,0,1,1,1,1,0,174,8,6
"Community Behavioral Health","142 Coursevall Drive Centreville, Maryland 21617",0,0,0,0,1,1,1,0,1,0,0,1,1,1,1,0,175,8,6
"Community Behavioral Health","809 Eastern Shore Drive Salisbury, Maryland 21804",0,0,0,0,1,1,1,0,1,0,0,1,1,1,1,0,176,8,6
"Committed to Change PC Psychiatric Rehabilitation","200 Glenn Street Cumberland, Maryland 21502",0,0,0,0,1,1,0,0,1,0,0,1,1,1,0,0,177,6,4
"Committed to Change PC","420 Chinquapin Round Road Suite 21 Annapolis, Maryland 21401",0,0,0,0,0,1,0,0,0,0,0,1,1,0,0,0,178,3,2
"ClearView Communities","611 West Patrick Street Frederick, Maryland 21701",0,0,0,0,0,0,0,0,1,0,0,1,0,0,0,0,179,2,0
"Chrysalis House Inc Chrysalis House Healthy Start","4500 Park Heights Avenue Baltimore, Maryland 21215",1,1,0,0,0,0,0,1,0,0,0,1,0,0,0,0,180,4,3
"Childrens Guild","6802 McClean Boulevard Parkville, Maryland 21234",0,0,0,0,0,1,1,0,1,0,0,1,0,0,0,0,181,4,2
"Chesapeake Healthcare","12145 Elm Street Princess Anne, Maryland 21853",1,0,0,0,1,1,1,1,1,1,1,1,1,1,1,1,182,13,11
"Chesapeake Healthcare","1813 Sweetbay Drive Salisbury, Maryland 21804",1,0,0,0,1,1,1,1,1,1,1,1,1,1,1,1,183,13,11
"Chesapeake Healthcare","560 Riverside Drive Suite A-204 Salisbury, Maryland 21801",1,0,0,0,1,1,1,1,1,1,1,1,1,1,1,1,184,13,11
"Chase Brexton Healthcare","200 Hospital Drive Suite 500 Glen Burnie, Maryland 21061",1,0,0,0,1,1,1,1,1,1,1,1,1,0,1,0,185,11,9
"Chase Brexton Health Services Randallstown Center","3510 Brenbrook Drive Randallstown, Maryland 21133",0,0,0,0,1,1,0,0,1,0,0,1,0,0,0,0,186,4,2
"Chase Brexton Health Services Mental Health Treatment Services","1111 North Charles Street Baltimore, Maryland 21201",1,0,0,0,1,1,0,1,1,0,0,1,1,0,0,0,187,7,5
"Chase Brexton Health Services Columbia Center","5500 Knoll North Drive Suite 400 Columbia, Maryland 21045",0,1,0,0,1,1,0,0,1,0,0,1,1,1,1,0,188,8,6
"Charles County Department of Health Division of Behavioral Health","4545 Crain Highway White Plains, Maryland 20695",0,0,1,0,1,1,1,0,1,0,0,1,1,0,0,0,189,7,5
"Changing Turn Comm Healthcare Services","500 Edgewood Road Suite 210 Edgewood, Maryland 21040",1,0,0,0,0,1,0,0,0,1,1,1,0,1,1,0,190,7,6
"Changing Lives at Home Mental Health","4805 Garrison Boulevard Baltimore, Maryland 21215",1,1,1,0,0,1,0,1,0,1,1,1,0,1,1,0,191,10,9
